{
  "schemaVersion": "1.0",
  "commandId": "activate-fixture-004",
  "action": "ACTIVATE",
  "outcome": "APPLIED",
  "connectionId": "bridge-connection-7f3c",
  "profileRef": {
    "profileId": "fixture.synthetic-socket",
    "revision": 2,
    "fingerprint": "sha256:1111111111111111111111111111111111111111111111111111111111111111"
  },
  "configRevision": 4,
  "configFingerprint": "sha256:2222222222222222222222222222222222222222222222222222222222222222",
  "runtimeRevision": 9,
  "runtimeFingerprint": "sha256:3333333333333333333333333333333333333333333333333333333333333333",
  "desiredRuntimeState": "ACTIVE",
  "actualRuntimeState": "ACTIVE",
  "blockers": [],
  "acknowledgedAt": "2026-08-24T19:05:05Z"
}
